{
  "$schema": "https://json-schema.org/draft/2020-12/schema",
  "$id": "https://github.com/dshills/plancritic/schema/review.v1.json",
  "title": "PlanCritic Review",
  "type": "object",
  "required": ["tool", "version", "input", "summary", "issues", "questions", "meta"],
  "properties": {
    "tool": { "type": "string", "const": "plancritic" },
    "version": { "type": "string" },
    "input": {
      "type": "object",
      "required": ["plan_file", "plan_hash"],
      "properties": {
        "plan_file": { "type": "string" },
        "plan_hash": { "type": "string" },
        "context_files": {
          "type": "array",
          "items": {
            "type": "object",
            "required": ["path", "hash"],
            "properties": {
              "path": { "type": "string" },
              "hash": { "type": "string" }
            }
          }
        },
        "profile": { "type": "string" },
        "strict": { "type": "boolean" }
      }
    },
    "summary": {
      "type": "object",
      "required": ["verdict", "score", "critical_count", "warn_count", "info_count"],
      "properties": {
        "verdict": { "type": "string", "enum": ["EXECUTABLE_AS_IS", "EXECUTABLE_WITH_CLARIFICATIONS", "NOT_EXECUTABLE"] },
        "score": { "type": "integer", "minimum": 0, "maximum": 100 },
        "critical_count": { "type": "integer", "minimum": 0 },
        "warn_count": { "type": "integer", "minimum": 0 },
        "info_count": { "type": "integer", "minimum": 0 }
      }
    },
    "issues": {
      "type": "array",
      "items": {
        "type": "object",
        "required": ["id", "severity", "category", "title", "description", "evidence"],
        "properties": {
          "id": { "type": "string", "pattern": "^ISSUE-" },
          "severity": { "type": "string", "enum": ["INFO", "WARN", "CRITICAL"] },
          "category": {
            "type": "string",
            "enum": [
              "CONTRADICTION", "AMBIGUITY", "MISSING_PREREQUISITE",
              "MISSING_ACCEPTANCE_CRITERIA", "RISK_SECURITY", "RISK_DATA",
              "RISK_OPERATIONS", "TEST_GAP", "SCOPE_CREEP_RISK",
              "UNREALISTIC_STEP", "ORDERING_DEPENDENCY",
              "UNSPECIFIED_INTERFACE", "NON_DETERMINISM"
            ]
          },
          "title": { "type": "string" },
          "description": { "type": "string" },
          "evidence": {
            "type": "array",
            "minItems": 1,
            "items": { "$ref": "#/$defs/evidence" }
          },
          "impact": { "type": "string" },
          "recommendation": { "type": "string" },
          "blocking": { "type": "boolean" },
          "tags": { "type": "array", "items": { "type": "string" } }
        }
      }
    },
    "questions": {
      "type": "array",
      "items": {
        "type": "object",
        "required": ["id", "severity", "question", "why_needed", "evidence"],
        "properties": {
          "id": { "type": "string", "pattern": "^Q-" },
          "severity": { "type": "string", "enum": ["INFO", "WARN", "CRITICAL"] },
          "question": { "type": "string" },
          "why_needed": { "type": "string" },
          "blocks": { "type": "array", "items": { "type": "string" } },
          "evidence": {
            "type": "array",
            "minItems": 1,
            "items": { "$ref": "#/$defs/evidence" }
          },
          "suggested_answers": { "type": "array", "items": { "type": "string" } }
        }
      }
    },
    "patches": {
      "type": "array",
      "items": {
        "type": "object",
        "required": ["id", "type", "title", "diff_unified"],
        "properties": {
          "id": { "type": "string", "pattern": "^PATCH-" },
          "type": { "type": "string", "enum": ["PLAN_TEXT_EDIT"] },
          "title": { "type": "string" },
          "diff_unified": { "type": "string" }
        }
      }
    },
    "checklists": {
      "type": "array",
      "items": {
        "type": "object",
        "required": ["id", "title", "checks"],
        "properties": {
          "id": { "type": "string" },
          "title": { "type": "string" },
          "checks": {
            "type": "array",
            "items": {
              "type": "object",
              "required": ["check", "status"],
              "properties": {
                "check": { "type": "string" },
                "status": { "type": "string", "enum": ["PASS", "FAIL", "N/A"] }
              }
            }
          }
        }
      }
    },
    "coverage": {
      "description": "Present only when a specification was supplied (--spec).",
      "type": "object",
      "required": ["requirements", "out_of_scope", "summary"],
      "properties": {
        "requirements": {
          "type": "array",
          "items": {
            "type": "object",
            "required": ["id", "requirement", "status", "spec_evidence", "plan_evidence"],
            "properties": {
              "id": { "type": "string", "pattern": "^REQ-" },
              "requirement": { "type": "string" },
              "status": { "type": "string", "enum": ["COVERED", "PARTIAL", "UNCOVERED"] },
              "spec_evidence": { "type": "array", "minItems": 1, "items": { "$ref": "#/$defs/spec_evidence" } },
              "plan_evidence": { "type": "array", "items": { "$ref": "#/$defs/plan_evidence" } },
              "note": { "type": "string" }
            },
            "if": { "properties": { "status": { "enum": ["COVERED", "PARTIAL"] } } },
            "then": { "properties": { "plan_evidence": { "minItems": 1 } } }
          }
        },
        "out_of_scope": {
          "type": "array",
          "items": {
            "type": "object",
            "required": ["id", "plan_step", "plan_evidence"],
            "properties": {
              "id": { "type": "string", "pattern": "^SCOPE-" },
              "plan_step": { "type": "string" },
              "plan_evidence": { "type": "array", "minItems": 1, "items": { "$ref": "#/$defs/plan_evidence" } },
              "note": { "type": "string" }
            }
          }
        },
        "summary": {
          "type": "object",
          "required": ["covered", "partial", "uncovered", "out_of_scope"],
          "properties": {
            "covered": { "type": "integer", "minimum": 0 },
            "partial": { "type": "integer", "minimum": 0 },
            "uncovered": { "type": "integer", "minimum": 0 },
            "out_of_scope": { "type": "integer", "minimum": 0 }
          }
        }
      }
    },
    "meta": {
      "type": "object",
      "required": ["model", "temperature"],
      "properties": {
        "model": { "type": "string" },
        "temperature": { "type": "number" }
      }
    }
  },
  "$defs": {
    "spec_evidence": {
      "description": "A citation into the specification (a context file).",
      "allOf": [
        { "$ref": "#/$defs/evidence" },
        { "properties": { "source": { "const": "context" } } }
      ]
    },
    "plan_evidence": {
      "description": "A citation into the plan.",
      "allOf": [
        { "$ref": "#/$defs/evidence" },
        { "properties": { "source": { "const": "plan" } } }
      ]
    },
    "evidence": {
      "type": "object",
      "required": ["source", "path", "line_start", "line_end", "quote"],
      "properties": {
        "source": { "type": "string", "enum": ["plan", "context"] },
        "path": { "type": "string" },
        "line_start": { "type": "integer", "minimum": 1 },
        "line_end": { "type": "integer", "minimum": 1 },
        "quote": { "type": "string" }
      }
    }
  }
}
